{
  "$schema": "http://json-schema.org/draft-07/schema#",
  "definitions": {
    "PromotionClass": {
      "enum": [
        "core",
        "simulation",
        "workflow",
        "donor_local",
        "reference_only"
      ],
      "type": "string"
    },
    "SchemaProvenance": {
      "properties": {
        "alias_history": {
          "items": {
            "type": "string"
          },
          "type": "array"
        },
        "donor": {
          "$ref": "#/definitions/SpecDonor"
        },
        "promotion_class": {
          "$ref": "#/definitions/PromotionClass"
        },
        "source_concept_name": {
          "type": "string"
        },
        "source_file_path": {
          "type": "string"
        }
      },
      "required": [
        "alias_history",
        "donor",
        "promotion_class",
        "source_concept_name",
        "source_file_path"
      ],
      "type": "object"
    },
    "SpecDonor": {
      "enum": [
        "mythforge",
        "orbis",
        "adventure_generator",
        "mappa_imperium",
        "dawn_of_worlds",
        "faction_image",
        "watabou_city",
        "encounter_balancer_scaffold"
      ],
      "type": "string"
    }
  },
  "properties": {
    "concept_id": {
      "type": "string"
    },
    "concept_name": {
      "type": "string"
    },
    "donor": {
      "$ref": "#/definitions/SpecDonor"
    },
    "provenance": {
      "$ref": "#/definitions/SchemaProvenance"
    },
    "reason": {
      "type": "string"
    }
  },
  "required": [
    "concept_id",
    "concept_name",
    "donor",
    "provenance",
    "reason"
  ],
  "title": "DroppedConceptRecord",
  "type": "object"
}